Modo,Jogadores,Histórico,Vencedor,Placar,Naipe Principal,Carta Virada,Início da Partida,Término da Partida
Singleplayer,"Tailann, Bot1, Bot2, Bot3","Carta virada (Bebi): Rei de Copas || Naipe principal: Copas || Cartas distribuídas:
Jogador 1: Dama de Paus, 3 de Paus, 2 de Paus
Jogador 2: Rei de Ouros, Ás de Paus, Valete de Ouros
Jogador 3: 3 de Espadas, Ás de Espadas, Valete de Paus
Jogador 4: Rei de Paus, Ás de Ouros, Ás de Copas || Rodada: Tailann: Dama de Paus, Bot1: Valete de Ouros, Bot2: Ás de Espadas, Bot3: Ás de Copas || Bot3 venceu a rodada. Motivo: A carta Ás de Copas foi a maior. || Rodada: Tailann: 2 de Paus, Bot1: Rei de Ouros, Bot2: 3 de Espadas, Bot3: Rei de Paus || Bot2 venceu a rodada. Motivo: A carta 3 de Espadas foi a maior. || Rodada: Tailann: 3 de Paus, Bot1: Ás de Paus, Bot2: Valete de Paus, Bot3: Ás de Ouros || Bot1 venceu a rodada. Motivo: A carta Ás de Paus foi a maior. || Dupla 2 venceu a partida com placar [1, 2]",Dupla 2,"[1, 2]",Copas,"('K', 'Copas')",2025-02-09 14:57:08,2025-02-09 14:57:09
Singleplayer,"Tailann, Bot1, Bot2, Bot3","Carta virada (Bebi): Rei de Copas || Naipe principal: Copas || Cartas distribuídas:
Jogador 1: Dama de Paus, 3 de Paus, 2 de Paus
Jogador 2: Rei de Ouros, Ás de Paus, Valete de Ouros
Jogador 3: 3 de Espadas, Ás de Espadas, Valete de Paus
Jogador 4: Rei de Paus, Ás de Ouros, Ás de Copas || Rodada: Tailann: Dama de Paus, Bot1: Valete de Ouros, Bot2: Ás de Espadas, Bot3: Ás de Copas || Bot3 venceu a rodada. Motivo: A carta Ás de Copas foi a maior. || Rodada: Tailann: 2 de Paus, Bot1: Rei de Ouros, Bot2: 3 de Espadas, Bot3: Rei de Paus || Bot2 venceu a rodada. Motivo: A carta 3 de Espadas foi a maior. || Rodada: Tailann: 3 de Paus, Bot1: Ás de Paus, Bot2: Valete de Paus, Bot3: Ás de Ouros || Bot1 venceu a rodada. Motivo: A carta Ás de Paus foi a maior. || Dupla 2 venceu a partida com placar [1, 2] || Dupla 2 venceu a partida com placar [1, 2]",Dupla 2,"[1, 2]",Copas,"('K', 'Copas')",2025-02-09 14:57:08,2025-02-09 14:57:09
Singleplayer,"t2, Bot1, Bot2, Bot3","Carta virada (Bebi): Dama de Copas || Naipe principal: Copas || Cartas distribuídas:
Jogador 1: Valete de Espadas, Valete de Ouros, Dama de Paus
Jogador 2: 3 de Paus, Dama de Espadas, Rei de Copas
Jogador 3: 3 de Espadas, Dama de Ouros, Rei de Ouros
Jogador 4: Valete de Copas, Ás de Ouros, Valete de Paus || Rodada: t2: Valete de Ouros, Bot1: Dama de Espadas, Bot2: Dama de Ouros, Bot3: Valete de Copas || Bot3 venceu a rodada. Motivo: A carta Valete de Copas foi a maior. || Rodada: t2: Valete de Espadas, Bot1: Rei de Copas, Bot2: Rei de Ouros, Bot3: Valete de Paus || Bot1 venceu a rodada. Motivo: A carta Rei de Copas foi a maior. || Rodada: t2: Dama de Paus, Bot1: 3 de Paus, Bot2: 3 de Espadas, Bot3: Ás de Ouros || Bot2 venceu a rodada. Motivo: A carta 3 de Espadas foi a maior. || Dupla 2 venceu a partida com placar [1, 2]",Dupla 2,"[1, 2]",Copas,"('Q', 'Copas')",2025-02-09 15:02:35,2025-02-09 15:02:41
Singleplayer,"Tailan, Bot1, Bot2, Bot3","Carta virada (Bebi): K de Espadas || Naipe principal: Espadas || Cartas distribuídas:
Jogador 1: Q de Ouros, A de Espadas, 3 de Espadas
Jogador 2: A de Ouros, K de Copas, J de Ouros
Jogador 3: Q de Copas, J de Espadas, J de Paus
Jogador 4: 2 de Espadas, K de Paus, A de Paus || Rodada: Tailan: Q de Ouros, Bot1: J de Ouros, Bot2: J de Paus, Bot3: K de Paus || Bot1 venceu a rodada. Motivo: A carta J de Ouros foi a maior. || Rodada: Tailan: 3 de Espadas, Bot1: A de Ouros, Bot2: Q de Copas, Bot3: 2 de Espadas || Tailan venceu a rodada. Motivo: A carta 3 de Espadas foi a maior. || Rodada: Tailan: A de Espadas, Bot1: K de Copas, Bot2: J de Espadas, Bot3: A de Paus || Bot2 venceu a rodada. Motivo: A carta J de Espadas foi a maior. || Dupla 1 venceu a partida com placar [2, 1]",Dupla 1,"[2, 1]",Espadas,"('K', 'Espadas')",2025-02-10 16:07:21,2025-02-10 16:07:23
Singleplayer,"Tailan, Bot1, Bot2, Bot3","Carta virada (Bebi): K de Espadas || Naipe principal: Espadas || Cartas distribuídas:
Jogador 1: Q de Ouros, A de Espadas, 3 de Espadas
Jogador 2: A de Ouros, K de Copas, J de Ouros
Jogador 3: Q de Copas, J de Espadas, J de Paus
Jogador 4: 2 de Espadas, K de Paus, A de Paus || Rodada: Tailan: Q de Ouros, Bot1: J de Ouros, Bot2: J de Paus, Bot3: K de Paus || Bot1 venceu a rodada. Motivo: A carta J de Ouros foi a maior. || Rodada: Tailan: 3 de Espadas, Bot1: A de Ouros, Bot2: Q de Copas, Bot3: 2 de Espadas || Tailan venceu a rodada. Motivo: A carta 3 de Espadas foi a maior. || Rodada: Tailan: A de Espadas, Bot1: K de Copas, Bot2: J de Espadas, Bot3: A de Paus || Bot2 venceu a rodada. Motivo: A carta J de Espadas foi a maior. || Dupla 1 venceu a partida com placar [2, 1] || Dupla 1 venceu a partida com placar [2, 1]",Dupla 1,"[2, 1]",Espadas,"('K', 'Espadas')",2025-02-10 16:07:21,2025-02-10 16:07:23
Singleplayer,"dcefe, Bot1, Bot2, Bot3","Carta virada (Bebi): Q de Espadas || Naipe principal: Espadas || Cartas distribuídas:
Jogador 1: 2 de Espadas, Q de Copas, 3 de Paus
Jogador 2: J de Paus, J de Ouros, K de Copas
Jogador 3: A de Paus, Q de Ouros, A de Espadas
Jogador 4: A de Copas, K de Ouros, J de Espadas || Rodada: dcefe: 3 de Paus, Bot1: J de Ouros, Bot2: A de Espadas, Bot3: K de Ouros || dcefe venceu a rodada. Motivo: A carta 3 de Paus foi a maior. || Rodada: dcefe: Q de Copas, Bot1: J de Paus, Bot2: Q de Ouros, Bot3: J de Espadas || Bot3 venceu a rodada. Motivo: A carta J de Espadas foi a maior. || Rodada: dcefe: 2 de Espadas, Bot1: K de Copas, Bot2: A de Paus, Bot3: A de Copas || dcefe venceu a rodada. Motivo: A carta 2 de Espadas foi a maior. || Dupla 1 venceu a partida com placar [2, 1]",Dupla 1,"[2, 1]",Espadas,"('Q', 'Espadas')",2025-02-10 16:11:13,2025-02-10 16:11:20
Singleplayer,"dcefe, Bot1, Bot2, Bot3","Carta virada (Bebi): Q de Espadas || Naipe principal: Espadas || Cartas distribuídas:
Jogador 1: 2 de Espadas, Q de Copas, 3 de Paus
Jogador 2: J de Paus, J de Ouros, K de Copas
Jogador 3: A de Paus, Q de Ouros, A de Espadas
Jogador 4: A de Copas, K de Ouros, J de Espadas || Rodada: dcefe: 3 de Paus, Bot1: J de Ouros, Bot2: A de Espadas, Bot3: K de Ouros || dcefe venceu a rodada. Motivo: A carta 3 de Paus foi a maior. || Rodada: dcefe: Q de Copas, Bot1: J de Paus, Bot2: Q de Ouros, Bot3: J de Espadas || Bot3 venceu a rodada. Motivo: A carta J de Espadas foi a maior. || Rodada: dcefe: 2 de Espadas, Bot1: K de Copas, Bot2: A de Paus, Bot3: A de Copas || dcefe venceu a rodada. Motivo: A carta 2 de Espadas foi a maior. || Dupla 1 venceu a partida com placar [2, 1] || Dupla 1 venceu a partida com placar [2, 1]",Dupla 1,"[2, 1]",Espadas,"('Q', 'Espadas')",2025-02-10 16:11:13,2025-02-10 16:11:20
Multiplayer,"qsqsqsqsqqs, qdqqsqs, xaaxxaax, axaxaxaxax","Carta virada (Bebi): K de Paus || Naipe principal: Paus || Cartas distribuídas:
Jogador 1: K de Espadas, J de Ouros, J de Copas
Jogador 2: A de Espadas, Q de Paus, A de Paus
Jogador 3: Q de Ouros, K de Ouros, 3 de Espadas
Jogador 4: 2 de Paus, A de Copas, K de Copas || qdqqsqs venceu a rodada. Motivo: A carta A de Paus foi a maior. || qdqqsqs venceu a rodada. Motivo: A carta Q de Paus foi a maior. || xaaxxaax venceu a rodada. Motivo: A carta 3 de Espadas foi a maior. || Dupla 2 venceu a partida com placar [1, 2]",Dupla 2,"[1, 2]",Paus,"('K', 'Paus')",2025-02-10 16:12:00,2025-02-10 16:12:51
